<?xml version="1.0" encoding="utf-8"?>

<!--
Copyright (c) 2006 Apple Computer, Inc. All rights reserved.

Licensed under the Apache License, Version 2.0 (the "License");
you may not use this file except in compliance with the License.
You may obtain a copy of the License at

    http://www.apache.org/licenses/LICENSE-2.0

Unless required by applicable law or agreed to in writing, software
distributed under the License is distributed on an "AS IS" BASIS,
WITHOUT WARRANTIES OR CONDITIONS OF ANY KIND, either express or implied.
See the License for the specific language governing permissions and
limitations under the License.
 -->

<!DOCTYPE repository SYSTEM "repository.dtd">

<repository>

  <docroot auto-principal-collection-set="yes">
    <collection>
      <pytype>twistedcaldav.root.RootResource</pytype>
      <properties>
        <acl>
          <ace>
            <principal><all/></principal>
            <grant><privilege><read/></privilege></grant>
          </ace>
          <ace>
            <principal><href>/principals/user/admin</href></principal>
            <grant><privilege><all/></privilege></grant>
            <protected/>
            <inheritable/>
          </ace>
        </acl>
      </properties>
      <members>
        <collection name="principals">
          <pytype>twistedcaldav.directory.principal.DirectoryPrincipalProvisioningResource</pytype>
          <properties/>
          <members/>
        </collection>
        <collection name="calendars">
          <pytype>twistedcaldav.static.CalendarHomeProvisioningFile</pytype>
          <properties/>
          <members/>
        </collection>
      </members>
    </collection>
  </docroot>

  <authentication>
    <basic enable="yes" onlyssl="yes" credentials="directory" node="/Search">
      <realm></realm>
    </basic>
    <digest enable="no" onlyssl="no" credentials="property">
      <realm></realm>
    </digest>
    <kerberos enable="no" onlyssl="no">
      <service></service>
    </kerberos>
  </authentication>

</repository>
