<?xml version="1.0" encoding="utf-8"?>

<!--
Copyright (c) 2006 Apple Computer, Inc. All rights reserved.

Licensed under the Apache License, Version 2.0 (the "License");
you may not use this file except in compliance with the License.
You may obtain a copy of the License at

    http://www.apache.org/licenses/LICENSE-2.0

Unless required by applicable law or agreed to in writing, software
distributed under the License is distributed on an "AS IS" BASIS,
WITHOUT WARRANTIES OR CONDITIONS OF ANY KIND, either express or implied.
See the License for the specific language governing permissions and
limitations under the License.
 -->

<!DOCTYPE repository SYSTEM "repository.dtd">

<repository>

  <docroot auto-principal-collection-set="yes">
    <collection>
      <pytype>twisted.web2.dav.static.DAVFile</pytype>
      <properties>
        <acl>
          <ace>
            <principal><authenticated/></principal>
            <grant><privilege><read/></privilege></grant>
            <protected/>
          </ace>
          <ace>
            <principal><href>/principals/users/admin</href></principal>
            <grant><privilege><all/></privilege></grant>
            <protected/>
            <inheritable/>
          </ace>
        </acl>
      </properties>
      <members>
        <!--
          We must define the calendar home location before the
          principals as auto-provisioning of accounts occurs when the
          principal collections are created and we need to have the
          calendar home path setup by then.
         -->
        <collection name="calendars" tag="calendars">
          <pytype>twistedcaldav.static.CalDAVFile</pytype>
          <properties>
            <acl>
              <ace>
                <principal><authenticated/></principal>
                <grant><privilege><read/></privilege></grant>
                <protected/>
              </ace>
            </acl>
          </properties>
          <members>
            <collection name="users">
              <pytype>twistedcaldav.static.CalendarHomeProvisioningFile</pytype>
              <properties>
                <acl>
                  <ace>
                    <principal><authenticated/></principal>
                    <grant><privilege><read/></privilege></grant>
                    <protected/>
                  </ace>
                </acl>
              </properties>
              <members/>
            </collection>
            <collection name="groups">
              <pytype>twistedcaldav.static.CalendarHomeProvisioningFile</pytype>
              <properties>
                <acl>
                  <ace>
                    <principal><authenticated/></principal>
                    <grant><privilege><read/></privilege></grant>
                    <protected/>
                  </ace>
                </acl>
              </properties>
              <members/>
            </collection>
            <collection name="resources">
              <pytype>twistedcaldav.static.CalendarHomeProvisioningFile</pytype>
              <properties>
                <acl>
                  <ace>
                    <principal><authenticated/></principal>
                    <grant><privilege><read/></privilege></grant>
                    <protected/>
                  </ace>
                </acl>
              </properties>
              <members/>
            </collection>
            <collection name="public">
              <properties>
                <acl>
                  <ace>
                    <principal><unauthenticated/></principal>
                    <grant><privilege><read/></privilege></grant>
                    <protected/>
                    <inheritable/>
                  </ace>
                  <ace>
                    <principal><authenticated/></principal>
                    <grant><privilege><read/></privilege></grant>
                    <protected/>
                    <inheritable/>
                  </ace>
                </acl>
              </properties>
              <members/>
            </collection>
          </members>
        </collection>
        <collection name="principals" initialize="yes">
          <pytype>twistedcaldav.directory.resource.DirectoryPrincipalProvisioningResource</pytype>
          <params>
            <param>
              <key>DirectoryNode</key>
              <value>/Search</value>
            </param>
          </params>
          <properties>
            <acl>
              <ace>
                <principal><authenticated/></principal>
                <grant><privilege><read/></privilege></grant>
                <protected/>
              </ace>
            </acl>
          </properties>
          <members>
            <collection name="users" tag="principals">
              <pytype>twistedcaldav.directory.resource.DirectoryUserPrincipalProvisioningResource</pytype>
              <properties>
                <acl>
                  <ace>
                    <principal><authenticated/></principal>
                    <grant><privilege><read/></privilege></grant>
                    <protected/>
                  </ace>
                </acl>
              </properties>
              <members/>
            </collection>
            <collection name="groups" tag="principals">
              <pytype>twistedcaldav.directory.resource.DirectoryGroupPrincipalProvisioningResource</pytype>
              <properties>
                <acl>
                  <ace>
                    <principal><authenticated/></principal>
                    <grant><privilege><read/></privilege></grant>
                    <protected/>
                  </ace>
                </acl>
              </properties>
              <members/>
            </collection>
            <collection name="resources" tag="principals">
              <pytype>twistedcaldav.directory.resource.DirectoryResourcePrincipalProvisioningResource</pytype>
              <properties>
                <acl>
                  <ace>
                    <principal><authenticated/></principal>
                    <grant><privilege><read/></privilege></grant>
                    <protected/>
                  </ace>
                </acl>
              </properties>
              <members/>
            </collection>
          </members>
        </collection>
      </members>
    </collection>
  </docroot>

  <authentication>
  	<basic enable="yes" onlyssl="yes" credentials="directory">
  	  <realm></realm>
  	</basic>
  	<digest enable="no" onlyssl="no" credentials="property">
  	  <realm></realm>
  	</digest>
  	<kerberos enable="no" onlyssl="no">
  	  <service></service>
  	</kerberos>
  </authentication>

  <accounts/>

</repository>
